{
    "character_name": "White Rabbit",
    "portrait_description": "An anthropomorphic white rabbit rendered in a soft, painted storybook style, with clean white fur and clearly visible pink eyes. The form is rabbit-like rather than human, with proportions left flexible to suit a whimsical fantasy presentation.",
    "pose_and_expression": "A neutral, upright pose suitable for portrait depiction, with a composed expression that does not imply motion or urgency.",
    "clothing_and_accessories": "A waistcoat fitted for a rabbitâ€™s body, with a pocket from which a small watch is associated as a defining accessory.",
    "notes": [
        "Exact size relative to humans is not specified and may be interpreted flexibly.",
        "Ear length, posture, and facial detailing beyond pink eyes are not described.",
        "The watch should be present as an accessory but not shown in active use.",
        "No additional clothing or accessories beyond the waistcoat and watch are described."
    ]
}